{
  "_meta": { "sample": true, "note": "SAMPLE / TEST DATA — illustrative only, not a real published post. Do not publish." },
  "schemaVersion": "1.0",
  "postId": "SAMPLE-rsmssb-result-2026",
  "title": "Forest Guard Direct Recruitment Exam — Final Result 2026",
  "department": "RSMSSB / Rajasthan Staff Selection Board",
  "advertisementNo": null,
  "postType": "result",
  "category": "RESULT",
  "sourceId": "rsmssb",
  "sourceLabel": "RSMSSB",
  "officialSourceUrl": "https://rsmssb.rajasthan.gov.in/",
  "officialPdfUrl": "https://rsmssb.rajasthan.gov.in/Static/Result/SAMPLE-FORESTGUARD-RESULT.pdf",
  "publishedDate": "2026-06-18",
  "updatedDate": "2026-06-18",
  "applicationMode": null,
  "summary": "RSMSSB ने Forest Guard Direct Recruitment Exam का final result जारी कर दिया है। चयनित अभ्यर्थी अपनी roll number से official PDF में परिणाम देख सकते हैं। आगे की प्रक्रिया हेतु official notification देखें।",
  "importantDates": {
    "notificationDate": null, "startDate": null, "lastDate": null, "feeLastDate": null,
    "examDate": "2026-03-12", "admitCardDate": null, "answerKeyDate": null,
    "resultDate": "2026-06-18", "correctionDate": null, "otherDates": []
  },
  "applicationFee": null,
  "ageLimit": null,
  "vacancyDetails": [],
  "eligibility": null,
  "selectionProcess": ["Document Verification", "Medical Examination"],
  "requiredDocuments": [],
  "howToApply": null,
  "importantLinks": {
    "officialNotificationPdf": "https://rsmssb.rajasthan.gov.in/Static/Result/SAMPLE-FORESTGUARD-RESULT.pdf",
    "officialWebsite": "https://rsmssb.rajasthan.gov.in/", "applyOnline": null, "login": null,
    "correctionForm": null, "admitCard": null, "answerKey": null, "result": "https://rsmssb.rajasthan.gov.in/Static/Result/SAMPLE-FORESTGUARD-RESULT.pdf",
    "syllabus": null, "otherOfficialLinks": []
  },
  "faqs": [],
  "aiConfidence": 88,
  "confidenceBreakdown": { "dates": 90, "result": 86 },
  "verificationStatus": "pending_review",
  "manualReviewRequired": true,
  "extractionWarnings": ["aiConfidence below 90 — manual review required"],
  "sourceEvidence": "official result PDF (sample reference)",
  "lastVerifiedAt": "2026-06-18",
  "reviewedBy": null,
  "reviewedAt": null
}
