{
  "_meta": { "sample": true, "note": "SAMPLE / TEST DATA — illustrative only, not a real published post. Do not publish." },
  "schemaVersion": "1.0",
  "postId": "SAMPLE-rssb-admit-2026",
  "title": "Agriculture Supervisor Direct Recruitment — Admit Card 2026",
  "department": "RSSB / Rajasthan Staff Selection Board",
  "advertisementNo": null,
  "postType": "admit_card",
  "category": "ADMIT_CARD",
  "sourceId": "rssb",
  "sourceLabel": "RSSB",
  "officialSourceUrl": "https://rssb.rajasthan.gov.in/",
  "officialPdfUrl": null,
  "publishedDate": "2026-06-15",
  "updatedDate": "2026-06-15",
  "applicationMode": null,
  "summary": "Agriculture Supervisor Direct Recruitment परीक्षा के admit card जारी कर दिए गए हैं। अभ्यर्थी official website से SSO ID/आवेदन क्रमांक द्वारा admit card download कर सकते हैं।",
  "importantDates": {
    "notificationDate": null, "startDate": null, "lastDate": null, "feeLastDate": null,
    "examDate": "2026-06-28", "admitCardDate": "2026-06-22", "answerKeyDate": null,
    "resultDate": null, "correctionDate": null, "otherDates": []
  },
  "applicationFee": null,
  "ageLimit": null,
  "vacancyDetails": [],
  "eligibility": null,
  "selectionProcess": [],
  "requiredDocuments": [],
  "howToApply": null,
  "importantLinks": {
    "officialNotificationPdf": null, "officialWebsite": "https://rssb.rajasthan.gov.in/",
    "applyOnline": null, "login": "https://sso.rajasthan.gov.in/", "correctionForm": null,
    "admitCard": "https://rssb.rajasthan.gov.in/", "answerKey": null, "result": null,
    "syllabus": null, "otherOfficialLinks": []
  },
  "faqs": [],
  "aiConfidence": 91,
  "confidenceBreakdown": { "dates": 92, "links": 90 },
  "verificationStatus": "pending_review",
  "manualReviewRequired": false,
  "extractionWarnings": [],
  "sourceEvidence": "official admit-card notice (sample reference)",
  "lastVerifiedAt": "2026-06-15",
  "reviewedBy": null,
  "reviewedAt": null
}
